{
  "drag": [
    {
      "t": 0,
      "grip": [
        -0.42,
        0.96,
        -0.1
      ],
      "tip": [
        -0.58,
        0.03,
        -2.015
      ]
    }
  ],
  "light": [
    {
      "t": 0,
      "grip": [
        -0.42,
        0.96,
        -0.1
      ],
      "tip": [
        -0.58,
        0.03,
        -2.015
      ]
    },
    {
      "t": 0.14,
      "grip": [
        -0.58,
        1.08,
        -0.12
      ],
      "tip": [
        -2.2,
        0.65,
        -1.1
      ]
    },
    {
      "t": 0.28,
      "grip": [
        -0.6,
        1.16,
        0.08
      ],
      "tip": [
        -2.62,
        1.16,
        -0.35
      ]
    },
    {
      "t": 0.44,
      "grip": [
        -0.52,
        1.18,
        0.35
      ],
      "tip": [
        -2.0,
        1.16,
        1.8
      ]
    },
    {
      "t": 0.54,
      "grip": [
        -0.22,
        1.0519,
        0.4811
      ],
      "tip": [
        -0.25,
        1.0319,
        2.6111
      ]
    },
    {
      "t": 0.64,
      "grip": [
        0.1,
        0.7917,
        0.5159
      ],
      "tip": [
        1.78,
        0.6917,
        1.8959
      ]
    },
    {
      "t": 0.74,
      "grip": [
        0.1,
        0.74,
        0.48
      ],
      "tip": [
        2.2,
        0.56,
        1.02
      ]
    },
    {
      "t": 0.82,
      "grip": [
        -0.34,
        0.9131,
        0.5513
      ],
      "tip": [
        -0.8,
        0.3131,
        2.2012
      ]
    },
    {
      "t": 0.9,
      "grip": [
        -0.44,
        0.9521,
        0.1651
      ],
      "tip": [
        -1.9,
        0.0721,
        0.5451
      ]
    },
    {
      "t": 0.96,
      "grip": [
        -0.44,
        0.9548,
        -0.0711
      ],
      "tip": [
        -1.4,
        0.0548,
        -1.3911
      ]
    },
    {
      "t": 1,
      "grip": [
        -0.42,
        0.96,
        -0.1
      ],
      "tip": [
        -0.58,
        0.03,
        -2.015
      ]
    }
  ],
  "heavy": [
    {
      "t": 0,
      "grip": [
        -0.42,
        0.96,
        -0.1
      ],
      "tip": [
        -0.58,
        0.03,
        -2.015
      ]
    },
    {
      "t": 0.2,
      "grip": [
        -0.45,
        1.4,
        -0.12
      ],
      "tip": [
        -1.6,
        2.65,
        -0.45
      ]
    },
    {
      "t": 0.35,
      "grip": [
        -0.22,
        1.6,
        0.4
      ],
      "tip": [
        -0.35,
        3.6,
        0.6
      ]
    },
    {
      "t": 0.55,
      "grip": [
        0,
        1.48,
        0.48
      ],
      "tip": [
        0,
        3.5,
        0.8
      ]
    },
    {
      "t": 0.68,
      "grip": [
        0,
        0.8,
        0.52
      ],
      "tip": [
        0,
        0.03,
        2.18
      ]
    },
    {
      "t": 0.82,
      "grip": [
        0,
        0.8,
        0.52
      ],
      "tip": [
        0,
        0.03,
        2.18
      ]
    },
    {
      "t": 0.9,
      "grip": [
        -0.44,
        1,
        0.12
      ],
      "tip": [
        -1.95,
        0.35,
        0.8
      ]
    },
    {
      "t": 0.96,
      "grip": [
        -0.44,
        0.98,
        -0.08
      ],
      "tip": [
        -1.4,
        0.08,
        -1.4
      ]
    },
    {
      "t": 1,
      "grip": [
        -0.42,
        0.96,
        -0.1
      ],
      "tip": [
        -0.58,
        0.03,
        -2.015
      ]
    }
  ],
  "light2": [
    {
      "grip": [
        0.1,
        0.74,
        0.48
      ],
      "tip": [
        2.2,
        0.56,
        1.02
      ],
      "t": 0
    },
    {
      "t": 0.2,
      "grip": [
        0.18,
        0.83,
        0.58
      ],
      "tip": [
        2.18,
        0.18,
        1.45
      ]
    },
    {
      "t": 0.32,
      "grip": [
        0.22,
        0.91,
        0.58
      ],
      "tip": [
        2.22,
        0.28,
        1.52
      ]
    },
    {
      "t": 0.43,
      "grip": [
        0.02,
        1.0,
        0.59
      ],
      "tip": [
        0.72,
        0.6,
        2.68
      ]
    },
    {
      "t": 0.55,
      "grip": [
        -0.42,
        0.78,
        0.57
      ],
      "tip": [
        -2.05,
        0.16,
        2.03
      ]
    },
    {
      "t": 0.62,
      "grip": [
        -0.53,
        0.72,
        0.25
      ],
      "tip": [
        -2.55,
        0.06,
        -0.1
      ]
    },
    {
      "t": 0.74,
      "grip": [
        -0.53,
        0.72,
        0.25
      ],
      "tip": [
        -2.55,
        0.06,
        -0.1
      ]
    },
    {
      "t": 0.88,
      "grip": [
        -0.48,
        0.82,
        0.15
      ],
      "tip": [
        -2.3,
        0.15,
        -0.5
      ]
    },
    {
      "t": 1,
      "grip": [
        -0.42,
        0.96,
        -0.1
      ],
      "tip": [
        -0.58,
        0.03,
        -2.015
      ]
    }
  ],
  "light3": [
    {
      "t": 0,
      "grip": [
        -0.53,
        0.72,
        0.25
      ],
      "tip": [
        -2.55,
        0.06,
        -0.1
      ]
    },
    {
      "t": 0.08,
      "grip": [
        -0.52,
        0.79,
        0.28
      ],
      "tip": [
        -2.62,
        0.15,
        0
      ]
    },
    {
      "t": 0.16,
      "grip": [
        -0.5,
        1.02,
        0.35
      ],
      "tip": [
        -2.57,
        0.93,
        0.65
      ]
    },
    {
      "t": 0.205,
      "grip": [
        -0.48,
        1.05,
        0.3
      ],
      "tip": [
        -2.56,
        1.02,
        0.45
      ]
    },
    {
      "t": 0.27,
      "grip": [
        -0.52,
        1.31,
        0.08
      ],
      "tip": [
        -2.16,
        2.3,
        -0.28
      ]
    },
    {
      "t": 0.34,
      "grip": [
        -0.5,
        1.52,
        -0.14
      ],
      "tip": [
        -1.24,
        3.15,
        -1.0
      ]
    },
    {
      "t": 0.44,
      "grip": [
        -0.4,
        1.66,
        0.05
      ],
      "tip": [
        -0.74,
        3.6,
        -0.6
      ]
    },
    {
      "t": 0.53,
      "grip": [
        -0.22,
        1.6,
        0.4
      ],
      "tip": [
        -0.35,
        3.6,
        0.6
      ]
    },
    {
      "t": 0.58,
      "grip": [
        0,
        1.48,
        0.48
      ],
      "tip": [
        0,
        3.5,
        0.8
      ]
    },
    {
      "t": 0.68,
      "grip": [
        0,
        0.8,
        0.52
      ],
      "tip": [
        0,
        0.03,
        2.18
      ]
    },
    {
      "t": 0.8,
      "grip": [
        0,
        0.8,
        0.52
      ],
      "tip": [
        0,
        0.03,
        2.18
      ]
    },
    {
      "t": 0.9,
      "grip": [
        -0.44,
        1,
        0.12
      ],
      "tip": [
        -1.95,
        0.35,
        0.8
      ]
    },
    {
      "t": 0.96,
      "grip": [
        -0.44,
        0.98,
        -0.08
      ],
      "tip": [
        -1.4,
        0.08,
        -1.4
      ]
    },
    {
      "t": 1,
      "grip": [
        -0.42,
        0.96,
        -0.1
      ],
      "tip": [
        -0.58,
        0.03,
        -2.015
      ]
    }
  ],
  "water": [
    {
      "t": 0,
      "grip": [
        -0.42,
        0.96,
        -0.1
      ],
      "tip": [
        -0.58,
        0.03,
        -2.015
      ]
    },
    {
      "t": 0.24,
      "grip": [
        -0.38,
        1.32,
        0.08
      ],
      "tip": [
        -2.15,
        1.52,
        -0.9
      ]
    },
    {
      "t": 0.42,
      "grip": [
        -0.18,
        1.32,
        0.38
      ],
      "tip": [
        -0.6,
        1.28,
        2.42
      ]
    },
    {
      "t": 0.67,
      "grip": [
        0.1,
        1.14,
        0.25
      ],
      "tip": [
        2.05,
        0.85,
        0.9
      ]
    },
    {
      "t": 0.82,
      "grip": [
        -0.4,
        1.15,
        0.45
      ],
      "tip": [
        -0.65,
        0.65,
        2.1
      ]
    },
    {
      "t": 0.9,
      "grip": [
        -0.44,
        1.08,
        0.12
      ],
      "tip": [
        -1.9,
        0.2,
        0.5
      ]
    },
    {
      "t": 0.96,
      "grip": [
        -0.44,
        0.98,
        -0.08
      ],
      "tip": [
        -1.4,
        0.08,
        -1.4
      ]
    },
    {
      "t": 1,
      "grip": [
        -0.42,
        0.96,
        -0.1
      ],
      "tip": [
        -0.58,
        0.03,
        -2.015
      ]
    }
  ],
  "parry": [
    {
      "t": 0,
      "grip": [
        -0.42,
        0.96,
        -0.1
      ],
      "tip": [
        -0.58,
        0.03,
        -2.015
      ]
    },
    {
      "t": 0.08,
      "grip": [
        -0.44,
        1.12,
        -0.14
      ],
      "tip": [
        -0.92,
        0.4,
        -1.32
      ]
    },
    {
      "t": 0.18,
      "grip": [
        -0.36,
        1.32,
        0.34
      ],
      "tip": [
        -1.1,
        0.8,
        -0.1
      ]
    },
    {
      "t": 0.24,
      "grip": [
        -0.28,
        1.34,
        0.56
      ],
      "tip": [
        -1.05,
        1.05,
        0.58
      ]
    },
    {
      "t": 0.3,
      "grip": [
        0.06,
        1.34,
        0.6
      ],
      "tip": [
        -0.86,
        1.05,
        0.8
      ]
    },
    {
      "t": 0.65,
      "grip": [
        0.06,
        1.34,
        0.6
      ],
      "tip": [
        -0.86,
        1.05,
        0.8
      ]
    },
    {
      "t": 0.78,
      "grip": [
        -0.44,
        1.12,
        -0.14
      ],
      "tip": [
        -0.92,
        0.4,
        -1.32
      ]
    },
    {
      "t": 0.9,
      "grip": [
        -0.42,
        0.96,
        -0.1
      ],
      "tip": [
        -0.58,
        0.03,
        -2.015
      ]
    },
    {
      "t": 1,
      "grip": [
        -0.42,
        0.96,
        -0.1
      ],
      "tip": [
        -0.58,
        0.03,
        -2.015
      ]
    }
  ],
  "lance": [
    {
      "t": 0,
      "grip": [
        -0.42,
        0.96,
        -0.1